{
  "$schema": "https://json-schema.org/draft/2020-12/schema",
  "type": "object",
  "additionalProperties": false,
  "required": ["repo", "base_ref", "packages"],
  "properties": {
    "request_ref": { "type": "string", "minLength": 1, "pattern": "\\S" },
    "repo": {
      "type": "string",
      "minLength": 1
    },
    "base_ref": {
      "type": "string",
      "minLength": 1
    },
    "concurrency": {
      "type": "integer",
      "minimum": 1,
      "description": "Only 1 is supported: packages share one worktree and run serially"
    },
    "deadline": {
      "type": "string",
      "format": "date-time"
    },
    "budget": {
      "type": "object",
      "additionalProperties": false,
      "required": ["weighted_tokens"],
      "properties": {
        "unlimited_tokens": {
          "const": true,
          "description": "Omit token threshold warnings"
        },
        "weighted_tokens": {
          "type": "integer",
          "minimum": 0,
          "description": "Observed token threshold; never blocks execution"
        },
        "cost": {
          "type": "number",
          "minimum": 0
        },
        "launches": {
          "type": "integer",
          "minimum": 0
        }
      }
    },
    "mode": {
      "type": "string",
      "pattern": "^(auto|strict|single:(chatgpt|claude))$",
      "description": "single:* is rejected by loadPlan until single-vendor routing reaches node routing"
    },
    "environment": {
      "type": "array",
      "maxItems": 20,
      "items": {
        "$ref": "#/$defs/check"
      },
      "description": "R09 environment checks for every package, run in the acceptance sandbox before dispatch; a failure holds the package as held:environment"
    },
    "packages": {
      "type": "array",
      "minItems": 1,
      "items": {
        "type": "object",
        "additionalProperties": false,
        "required": ["id", "title", "goal", "scope", "accept", "risk", "size"],
        "properties": {
          "id": {
            "type": "string",
            "pattern": "^[A-Za-z0-9][A-Za-z0-9_-]{0,63}$"
          },
          "title": {
            "type": "string",
            "minLength": 1
          },
          "goal": {
            "type": "string",
            "minLength": 1,
            "maxLength": 2000
          },
          "scope": {
            "type": "object",
            "additionalProperties": false,
            "required": ["write"],
            "properties": {
              "write": {
                "type": "array",
                "minItems": 1,
                "items": {
                  "type": "string",
                  "minLength": 1
                }
              },
              "read_hint": {
                "type": "array",
                "items": {
                  "type": "string"
                }
              },
              "artifact_paths": {
                "type": "array",
                "items": {
                  "type": "object",
                  "additionalProperties": false,
                  "required": ["repo_role", "path", "purpose"],
                  "properties": {
                    "repo_role": {
                      "enum": ["target_main", "attempt", "engine", "temp"]
                    },
                    "path": {
                      "type": "string",
                      "minLength": 1,
                      "maxLength": 4096
                    },
                    "purpose": {
                      "type": "string",
                      "minLength": 1,
                      "maxLength": 1000
                    }
                  }
                }
              }
            }
          },
          "deps": {
            "type": "array",
            "items": {
              "type": "string"
            }
          },
          "requirements": { "$ref": "#/$defs/requirements" },
          "accept": {
            "type": "array",
            "minItems": 1,
            "items": {
              "$ref": "#/$defs/check"
            }
          },
          "accept_quick": {
            "type": "array",
            "items": {
              "$ref": "#/$defs/check"
            }
          },
          "environment": {
            "type": "array",
            "maxItems": 20,
            "items": {
              "$ref": "#/$defs/check"
            },
            "description": "R09 package environment checks, appended to the plan-level checks"
          },
          "fixture_exemptions": {
            "type": "array",
            "items": {
              "type": "object",
              "additionalProperties": false,
              "required": ["path", "purpose"],
              "properties": {
                "path": {
                  "type": "string",
                  "minLength": 1
                },
                "purpose": {
                  "type": "string",
                  "minLength": 1,
                  "maxLength": 1000
                }
              }
            }
          },
          "risk": {
            "enum": ["G0", "G1", "G2"]
          },
          "size": {
            "enum": ["S", "M", "L"]
          },
          "signoff": {
            "enum": ["auto", "human"],
            "default": "auto",
            "description": "G2 qualified PASS integrates automatically unless human signoff is requested"
          },
          "review": {
            "type": "boolean",
            "description": "Request milestone review; G2 and strict always require review"
          },
          "effort": {
            "enum": ["low", "medium", "high", "xhigh", "max"],
            "description": "Legacy input accepted; dispatch follows policy.effort"
          },
          "notes": {
            "type": "string"
          },
          "milestone": {
            "type": "string",
            "pattern": "^[A-Za-z][A-Za-z0-9_-]{0,31}$",
            "description": "Review batch; packages sharing a milestone are reviewed together. Default m1"
          },
          "caps": {
            "$ref": "#/$defs/caps",
            "description": "Per-package override of the plan-level caps"
          }
        }
      }
    },
    "console": {
      "enum": ["claude", "codex"],
      "description": "Selects the reviewer pool (tiers.json routing.reviewer.by_console); default claude"
    },
    "caps": {
      "$ref": "#/$defs/caps",
      "description": "Worker capabilities for every package; default all allowed (docs/00-architecture.md caps)"
    }
  },
  "$defs": {
    "requirements": {
      "type": "array",
      "minItems": 1,
      "items": {
        "type": "object",
        "additionalProperties": false,
        "required": ["id", "text", "verified_by"],
        "properties": {
          "id": { "type": "string", "pattern": "^[A-Za-z0-9][A-Za-z0-9_-]{0,63}$" },
          "text": { "type": "string", "minLength": 1, "pattern": "\\S" },
          "verified_by": {
            "type": "array",
            "minItems": 1,
            "uniqueItems": true,
            "items": { "type": "integer", "minimum": 0 }
          }
        }
      }
    },
    "check": {
      "type": "object",
      "additionalProperties": false,
      "required": ["cmd", "timeout_s"],
      "properties": {
        "cmd": {
          "type": "string",
          "minLength": 1
        },
        "timeout_s": {
          "type": "integer",
          "minimum": 1
        },
        "cache": {
          "type": "boolean",
          "default": true,
          "description": "Acceptance checks reuse pass or failure results by default for the same tree, command, timeout and environment within the run (F-21); set false for commands with external writes or time/randomness dependencies. Environment checks are never reused."
        },
        "report": {
          "type": "object",
          "additionalProperties": false,
          "required": ["junit"],
          "properties": {
            "junit": {
              "type": "string",
              "minLength": 1,
              "pattern": "^(?!/)(?!.*(?:^|/)\\.\\.(?:/|$)).+"
            },
            "collect": { "type": "string", "minLength": 1 }
          }
        },
        "known_failures": {
          "type": "array",
          "uniqueItems": true,
          "items": {
            "type": "object",
            "additionalProperties": false,
            "required": ["id", "reason"],
            "properties": {
              "id": { "type": "string", "minLength": 1 },
              "reason": { "type": "string", "minLength": 1 }
            }
          }
        }
      }
    },
    "caps": {
      "type": "object",
      "additionalProperties": false,
      "properties": {
        "network": {
          "type": "boolean"
        },
        "web": {
          "type": "boolean"
        },
        "install": {
          "type": "boolean"
        },
        "services": {
          "type": "boolean"
        },
        "long_tests": {
          "type": "boolean"
        },
        "read": {
          "enum": ["any", "scope"]
        },
        "git": {
          "enum": ["branch", "commit"]
        },
        "mcp": {
          "type": "array",
          "items": {
            "type": "string",
            "minLength": 1
          }
        }
      }
    }
  }
}
